{"canvas_id":"canvas:kaspa:kaspa-forge-vault-v3","chain_scope":{"chain":"kaspa","network":"kaspa-testnet-11","schema_version":1},"graph":{"edges":[{"id":"vault-initiate","relation":"transition","source":"vault-state","target":"initiate"},{"id":"initiate-unvaulting","relation":"transition","source":"initiate","target":"unvaulting-state"},{"id":"unvaulting-complete","relation":"transition","source":"unvaulting-state","target":"complete"},{"id":"complete-recipient","relation":"transition","source":"complete","target":"recipient-output"},{"id":"unvaulting-cancel","relation":"transition","source":"unvaulting-state","target":"cancel"},{"id":"cancel-vault","label":"restore","relation":"transition","source":"cancel","target":"vault-state"},{"id":"vault-checkin","relation":"transition","source":"vault-state","target":"checkin"},{"id":"checkin-vault","label":"reset age","relation":"transition","source":"checkin","target":"vault-state"},{"id":"vault-inherit-auto","relation":"transition","source":"vault-state","target":"inherit-auto"},{"id":"inherit-auto-heir","relation":"transition","source":"inherit-auto","target":"heir-output"},{"id":"vault-inherit-signed","relation":"transition","source":"vault-state","target":"inherit-signed"},{"id":"inherit-signed-heir","relation":"transition","source":"inherit-signed","target":"heir-output"},{"id":"vault-migrate","relation":"transition","source":"vault-state","target":"migrate"},{"id":"unvaulting-migrate","relation":"transition","source":"unvaulting-state","target":"migrate"},{"id":"migrate-output","relation":"transition","source":"migrate","target":"migration-output"},{"id":"shared-initiate","relation":"shared-guard","source":"shared-envelope","target":"initiate"},{"id":"shared-cancel","relation":"shared-guard","source":"shared-envelope","target":"cancel"},{"id":"shared-complete","relation":"shared-guard","source":"shared-envelope","target":"complete"},{"id":"shared-checkin","relation":"shared-guard","source":"shared-envelope","target":"checkin"},{"id":"shared-inherit-auto","relation":"shared-guard","source":"shared-envelope","target":"inherit-auto"},{"id":"shared-inherit-signed","relation":"shared-guard","source":"shared-envelope","target":"inherit-signed"},{"id":"shared-migrate","label":"single input only","relation":"shared-guard","source":"shared-envelope","target":"migrate"}],"nodes":[{"id":"shared-envelope","kind":"shared","modules":[{"detail":"Every path rejects transactions with more than one input.","id":"single-input","interfaceId":"covenant.interface/transaction.single-input","tier":"chain-independent","title":"One active vault input"},{"detail":"Value-bound paths require 0 < feeBudget <= 0.1 KAS.","id":"bounded-fee","interfaceId":"covenant.interface/value.bounded-transition-fee","tier":"capability-bound","title":"Bounded transition fee"},{"detail":"tx.outputs[0] must retain at least the active input value minus feeBudget.","id":"principal-floor","tier":"kaspa-native","title":"Kaspa output value floor"}],"position":{"x":300,"y":-100},"sharedModuleIds":[],"sourceLines":[24,52],"subtitle":"Guards inherited by value-bound paths","title":"Shared transition envelope"},{"id":"vault-state","kind":"state","modules":[{"detail":"Funds remain under the vault policy until one permitted transition succeeds.","id":"vault-state-portable","interfaceId":"covenant.interface/state.vault","tier":"chain-independent","title":"Stored funds"}],"position":{"x":0,"y":250},"sharedModuleIds":[],"sourceLines":[3,6],"subtitle":"mode = 0 · stable vault address","title":"VAULT"},{"id":"initiate","kind":"transition","modules":[{"detail":"Move VAULT into a pending withdrawal carrying a fixed destination.","id":"initiate-portable","interfaceId":"covenant.interface/initiate.intent","tier":"chain-independent","title":"Start withdrawal"},{"detail":"Require hot-key authority, preserve principal, and bind the next state.","id":"initiate-capability","interfaceId":"covenant.interface/initiate.enforcement","tier":"capability-bound","title":"Authorize + commit successor"},{"detail":"Build a 36-byte Kaspa P2PK destination and validate output state 0.","id":"initiate-kaspa","tier":"kaspa-native","title":"checkSig + validateOutputState"}],"position":{"x":260,"y":210},"sharedModuleIds":["single-input","bounded-fee","principal-floor"],"sourceLines":[54,65],"subtitle":"Hot key starts a delayed withdrawal","title":"initiate"},{"id":"unvaulting-state","kind":"state","modules":[{"detail":"The recipient is fixed while the delay window runs.","id":"unvaulting-state-portable","interfaceId":"covenant.interface/state.pending-withdrawal","tier":"chain-independent","title":"Pending withdrawal"}],"position":{"x":570,"y":250},"sharedModuleIds":[],"sourceLines":[4,10],"subtitle":"mode = 1 · delay window active","title":"UNVAULTING"},{"id":"complete","kind":"transition","modules":[{"detail":"Release principal only to the destination committed during initiate.","id":"complete-portable","interfaceId":"covenant.interface/complete.intent","tier":"chain-independent","title":"Complete withdrawal"},{"detail":"Require a relative age threshold and constrain the recipient and value.","id":"complete-capability","interfaceId":"covenant.interface/complete.enforcement","tier":"capability-bound","title":"Delay + destination binding"},{"detail":"Compare DAA age, version-prefixed scriptPubKey, and output value.","id":"complete-kaspa","tier":"kaspa-native","title":"this.age + output introspection"}],"position":{"x":830,"y":70},"sharedModuleIds":["single-input","bounded-fee","principal-floor"],"sourceLines":[78,86],"subtitle":"Release after the DAA delay","title":"complete"},{"id":"cancel","kind":"transition","modules":[{"detail":"Return UNVAULTING to the canonical VAULT state.","id":"cancel-portable","interfaceId":"covenant.interface/cancel.intent","tier":"chain-independent","title":"Cancel withdrawal"},{"detail":"Require alarm-key authority, reset destination, and preserve principal.","id":"cancel-capability","interfaceId":"covenant.interface/cancel.enforcement","tier":"capability-bound","title":"Alarm authorization"},{"detail":"Validate a mode 0 successor with the zero destination encoding.","id":"cancel-kaspa","tier":"kaspa-native","title":"checkSig + validateOutputState"}],"position":{"x":830,"y":320},"sharedModuleIds":["single-input","bounded-fee","principal-floor"],"sourceLines":[67,76],"subtitle":"Alarm key restores the vault","title":"cancel"},{"id":"recipient-output","kind":"outcome","modules":[{"detail":"Principal can leave the covenant only for the previously committed recipient.","id":"recipient-portable","interfaceId":"covenant.interface/output.bound-recipient","tier":"chain-independent","title":"Bound recipient"}],"position":{"x":1150,"y":120},"sharedModuleIds":[],"sourceLines":[78,85],"subtitle":"the destination fixed by initiate","title":"Recipient P2PK"},{"id":"checkin","kind":"transition","modules":[{"detail":"Recreate VAULT without moving principal to reset the inheritance timer.","id":"checkin-portable","interfaceId":"covenant.interface/checkin.intent","tier":"chain-independent","title":"Prove liveness"},{"detail":"Require hot-key authority and an equivalent successor state/value.","id":"checkin-capability","interfaceId":"covenant.interface/checkin.enforcement","tier":"capability-bound","title":"Authorize + preserve state"},{"detail":"Validate output state 0 with the canonical zero destination.","id":"checkin-kaspa","tier":"kaspa-native","title":"checkSig + validateOutputState"}],"position":{"x":260,"y":470},"sharedModuleIds":["single-input","bounded-fee","principal-floor"],"sourceLines":[88,97],"subtitle":"Hot key resets liveness age","title":"checkin"},{"id":"inherit-auto","kind":"transition","modules":[{"detail":"After owner inactivity, release principal only to the configured heir.","id":"inherit-auto-portable","interfaceId":"covenant.interface/inherit-auto.intent","tier":"chain-independent","title":"Automatic inheritance"},{"detail":"Require automatic mode, inheritance delay, non-zero heir, and bound value.","id":"inherit-auto-capability","interfaceId":"covenant.interface/inherit-auto.enforcement","tier":"capability-bound","title":"Age + fixed heir output"},{"detail":"Inspect DAA age and constrain output 0 to the 36-byte heir scriptPubKey.","id":"inherit-auto-kaspa","tier":"kaspa-native","title":"this.age + Kaspa P2PK"}],"position":{"x":260,"y":720},"sharedModuleIds":["single-input","bounded-fee","principal-floor"],"sourceLines":[99,115],"subtitle":"Anyone may deliver expired funds to heir","title":"inheritAuto"},{"id":"inherit-signed","kind":"transition","modules":[{"detail":"After owner inactivity, the configured heir actively claims principal.","id":"inherit-signed-portable","interfaceId":"covenant.interface/inherit-signed.intent","tier":"chain-independent","title":"Signed inheritance"},{"detail":"Require manual mode, inheritance delay, non-zero heir, signature, and bound value.","id":"inherit-signed-capability","interfaceId":"covenant.interface/inherit-signed.enforcement","tier":"capability-bound","title":"Age + heir authorization"},{"detail":"Use DAA age, Kaspa signature verification, and output script introspection.","id":"inherit-signed-kaspa","tier":"kaspa-native","title":"this.age + checkSig + P2PK"}],"position":{"x":570,"y":720},"sharedModuleIds":["single-input","bounded-fee","principal-floor"],"sourceLines":[117,131],"subtitle":"Heir claims after owner inactivity","title":"inheritSigned"},{"id":"heir-output","kind":"outcome","modules":[{"detail":"Both inheritance modes deliver principal to the configured non-zero heir.","id":"heir-portable","interfaceId":"covenant.interface/output.bound-heir","tier":"chain-independent","title":"Bound heir"}],"position":{"x":920,"y":770},"sharedModuleIds":[],"sourceLines":[99,130],"subtitle":"hard-bound inheritance destination","title":"Heir P2PK"},{"id":"migrate","kind":"transition","modules":[{"detail":"Full owner authority can upgrade, rotate keys, rescue, or exit from either st